{
  "schema_version": "1.0",
  "semantic_recurrence_limit": 2,
  "families": [
    {
      "id": "authorization-lifecycle",
      "title": "Authorization, approval, scope and lifecycle",
      "stateful": true,
      "review_questions": [
        "Are all executable decisions and lifecycle transitions loaded from trusted current source of truth?",
        "Do omitted, stale or caller-controlled scope, target, approval, adapter or lifecycle fields fail closed?",
        "Is AUTHORIZED kept distinct from a durable post-pre-dispatch claim for secret injection, provider submit and result collection?",
        "Were all public entry points, alternate callers and sibling state transitions audited?"
      ]
    },
    {
      "id": "secret-plaintext-boundary",
      "title": "Secrets, plaintext and LLM-visible data",
      "stateful": true,
      "review_questions": [
        "Can secret values or raw output reach prompts, normal storage, logs, exceptions or reports?",
        "Do every public resolve, read, export and recovery path enforce the same reference-only boundary?",
        "Can caller-created receipts, quarantine references, publications, callbacks or compatibility loaders obtain plaintext or choose its destination?",
        "Does only the winning Executor call obtain a one-call Secret delivery continuation, with exact-version lifecycle validation and no reusable consumed-claim resolver or lifetime-use counter?"
      ]
    },
    {
      "id": "integrity-cryptography-keys",
      "title": "Integrity, authenticated encryption and key domains",
      "stateful": true,
      "review_questions": [
        "Are digests, IDs, bindings, algorithms, nonces and key domains checked on both write and read?",
        "Do rotation, revocation and unavailable-key paths fail closed without plaintext or cross-domain fallback?",
        "Do external generation anchors bind the exact state digest and immutable blob identity, not only an integer generation?",
        "For Phase 0C production, does the authenticated record/blob pair match the current TPM NV Extend digest, with explicit Genesis and no automatic reseed or unqualified D4 erasure?"
      ]
    },
    {
      "id": "audit-recovery-durability",
      "title": "Audit, retry, recovery and durable state",
      "stateful": true,
      "review_questions": [
        "Are crash, retry, reconciliation and unknown-outcome transitions complete and non-duplicating?",
        "Are audit ordering, integrity and recovery decisions derived from durable trusted state?",
        "Does post-ingestion erasure verify the durable manifest, projection and every referenced resource, while typed expiry erasure verifies its own complete evidence without fabricating a manifest or successful result?",
        "Do all erasure paths require the dedicated one-use claim, exact resource/key/copy inventory and same-identity reconciliation after an unknown outcome?"
      ]
    },
    {
      "id": "filesystem-concurrency-retention",
      "title": "Filesystem, concurrency, quota and retention",
      "stateful": true,
      "review_questions": [
        "Are traversal, symlink, race, atomicity, ownership, quota and cleanup paths covered?",
        "Are retention and lease decisions based on trusted time and durable current state?",
        "Does result retention start at the persisted trusted collection time and use the exact trusted tool output limit across restart?"
      ]
    },
    {
      "id": "untrusted-output-parsing",
      "title": "Untrusted parsing, schemas and output boundaries",
      "stateful": false,
      "review_questions": [
        "Are duplicate keys, unknown fields, coercion, malformed metadata and prompt injection rejected at the actual boundary?",
        "Do alternate parsers and compatibility readers preserve the same fail-closed behavior?"
      ]
    },
    {
      "id": "acceptance-compatibility",
      "title": "Acceptance completeness and earlier-phase compatibility",
      "stateful": false,
      "review_questions": [
        "Does every acceptance criterion have positive, negative and failure-path evidence?",
        "Do changed interfaces preserve every earlier-phase safety invariant while obsolete authority inputs are rejected under the approved migration contract?",
        "Does each reuse/replace/new unit match the current specification, cover all affected callers and recovery paths, and retain the earlier regression scenarios without weakening tests?"
      ]
    }
  ],
  "phases": {
    "phase-0a": [
      "authorization-lifecycle",
      "integrity-cryptography-keys",
      "untrusted-output-parsing",
      "acceptance-compatibility"
    ],
    "phase-0b": [
      "authorization-lifecycle",
      "audit-recovery-durability",
      "filesystem-concurrency-retention",
      "untrusted-output-parsing",
      "acceptance-compatibility"
    ],
    "phase-0c": [
      "authorization-lifecycle",
      "secret-plaintext-boundary",
      "integrity-cryptography-keys",
      "audit-recovery-durability",
      "filesystem-concurrency-retention",
      "untrusted-output-parsing",
      "acceptance-compatibility"
    ],
    "phase-1": [
      "authorization-lifecycle",
      "secret-plaintext-boundary",
      "audit-recovery-durability",
      "untrusted-output-parsing",
      "acceptance-compatibility"
    ],
    "phase-2": [
      "authorization-lifecycle",
      "secret-plaintext-boundary",
      "integrity-cryptography-keys",
      "untrusted-output-parsing",
      "acceptance-compatibility"
    ],
    "phase-3": [
      "authorization-lifecycle",
      "audit-recovery-durability",
      "filesystem-concurrency-retention",
      "acceptance-compatibility"
    ],
    "phase-4": [
      "authorization-lifecycle",
      "secret-plaintext-boundary",
      "integrity-cryptography-keys",
      "audit-recovery-durability",
      "filesystem-concurrency-retention",
      "untrusted-output-parsing",
      "acceptance-compatibility"
    ],
    "phase-5": [
      "authorization-lifecycle",
      "secret-plaintext-boundary",
      "integrity-cryptography-keys",
      "audit-recovery-durability",
      "filesystem-concurrency-retention",
      "untrusted-output-parsing",
      "acceptance-compatibility"
    ]
  }
}
